{
  "schemaVersion": "1.0",
  "asOf": "2026-07-27",
  "status": "screening_only_not_donor_assessment",
  "method": {
    "ruleEn": "This screen ranks public official acquisition routes. It does not score D1-D10, accept a donor market or change the 0/3 gate.",
    "ruleFi": "Seulonta järjestää julkiset viralliset tiedonhankintareitit. Se ei pisteytä D1-D10-ehtoja, hyväksy luovuttajamarkkinaa eikä muuta 0/3-porttia.",
    "rankingBasisEn": "Priority reflects the strength of the official value or volume signal, feasibility of obtaining a national aggregate, scope clarity, reproducibility and operational friction.",
    "rankingBasisFi": "Järjestys perustuu virallisen arvo- tai määräsignaalin vahvuuteen, valtakunnallisen koosteen saatavuuteen, rajauksen selkeyteen, toistettavuuteen ja operatiiviseen kitkaan."
  },
  "decision": {
    "primaryProgrammeCountryIso2": "PL",
    "sourceOnlyLeadCountryIso2": "RU",
    "secondaryProgrammeCountryIso2": ["FI", "DK", "FR"],
    "reasonEn": "Poland is the most practical third programme because official sources now expose a 2020–2023 e-liquid flow series, realised 2025 product-specific excise and a reproducible second-half device tax-base bridge, while the EU-CEG route can close definition and coverage gaps. Russia exposes the strongest new official value signal, but sanctions, illegal-market and reproducibility friction make it a source-only lead. Finland, Denmark and France form the secondary official-request wave.",
    "reasonFi": "Puola on käytännöllisin kolmas ohjelma, koska viralliset lähteet julkaisevat nyt vuosien 2020–2023 nesteseriesin, toteutuneen vuoden 2025 tuotekohtaisen valmisteveron ja toistettavan loppuvuoden laiteveropohjasillan, ja EU-CEG-reitti voi sulkea määritelmä- ja peittopuutteita. Venäjä tarjoaa vahvimman uuden virallisen arvosignaalin, mutta pakote-, laiton markkina- ja toistettavuuskitka rajaavat sen vain lähdejohtolangaksi. Suomi, Tanska ja Ranska muodostavat toissijaisen viranomaispyyntöaallon."
  },
  "countries": [
    {
      "rank": 1,
      "countryIso2": "RU",
      "countryEn": "Russia",
      "countryFi": "Venäjä",
      "programmeClass": "source_only_high_friction",
      "donorStatus": "not_assessed",
      "evidenceSignalEn": "An official market report publishes marked retail value and liquid litres for a full year and separates adjacent product groups.",
      "evidenceSignalFi": "Virallinen markkinaraportti julkaisee kokonaisen vuoden merkityn vähittäisarvon ja nestelitrat sekä erottaa viereisiä tuoteryhmiä.",
      "blockingGapsEn": ["Device coverage", "Illegal-market boundary", "Independent reconciliation", "Operational and sanctions constraints"],
      "blockingGapsFi": ["Laitepeitto", "Laittoman markkinan rajaus", "Riippumaton täsmäytys", "Operatiiviset ja pakoterajoitteet"],
      "officialSources": [
        {
          "labelEn": "NNCK market review Q4 2025",
          "labelFi": "NNCK:n markkinakatsaus Q4/2025",
          "url": "https://nnck.gov.ru/hmenu/obzor-rynkov/2025/%D0%9E%D0%B1%D0%B7%D0%BE%D1%80%20%D0%9D%D0%A1%D0%9F%20-%204%D0%BA%D0%B22025.pdf",
          "verifiedOn": "2026-07-27"
        }
      ]
    },
    {
      "rank": 2,
      "countryIso2": "PL",
      "countryEn": "Poland",
      "countryFi": "Puola",
      "programmeClass": "primary_programme",
      "donorStatus": "not_assessed",
      "evidenceSignalEn": "Official sources publish 2020–2023 national e-liquid flows and realised 2025 product-specific excise; PLN 40 unit rates reproduce a second-half device and component-set tax-base bridge.",
      "evidenceSignalFi": "Viralliset lähteet julkaisevat vuosien 2020–2023 valtakunnalliset nestevirrat ja toteutuneen vuoden 2025 tuotekohtaisen valmisteveron; 40 PLN:n yksikköverot toistavat loppuvuoden laite- ja osasarjaveropohjasillan.",
      "blockingGapsEn": ["Full-year devices and consumables on one boundary", "Consumer-retail value and tax basis", "Coverage and missingness", "Independent reconciliation"],
      "blockingGapsFi": ["Koko vuoden laitteet ja kulutustarvikkeet samalla rajauksella", "Kuluttajavähittäisarvo ja veroperusta", "Peitto ja puuttuvuus", "Riippumaton täsmäytys"],
      "officialSources": [
        {
          "labelEn": "Polish Ministry of Finance response — 2020–2023 national flows",
          "labelFi": "Puolan valtiovarainministeriön vastaus — vuosien 2020–2023 kansalliset virrat",
          "url": "https://api.sejm.gov.pl/sejm/term10/interpellations/attachment/ATTDDEJZ5/i07255-o1.pdf",
          "verifiedOn": "2026-07-27"
        },
        {
          "labelEn": "Polish Ministry of Finance response — realised 2025 excise",
          "labelFi": "Puolan valtiovarainministeriön vastaus — toteutunut vuoden 2025 valmistevero",
          "url": "https://api.sejm.gov.pl/sejm/term10/interpellations/attachment/ATTDVKHSJ/i17526-o1.pdf",
          "verifiedOn": "2026-07-27"
        },
        {
          "labelEn": "Polish Ministry of Finance excise rates",
          "labelFi": "Puolan valtiovarainministeriön valmisteverokannat",
          "url": "https://www.podatki.gov.pl/akcyza/stawki-podatkowe/",
          "verifiedOn": "2026-07-27"
        },
        {
          "labelEn": "Polish Bureau for Chemical Substances notification guidance",
          "labelFi": "Puolan kemikaaliviraston ilmoitusohje",
          "url": "https://www.gov.pl/web/chemical/notification-of-electronic-cigarettes-and-refill-containers",
          "verifiedOn": "2026-07-27"
        }
      ]
    },
    {
      "rank": 3,
      "countryIso2": "FI",
      "countryEn": "Finland",
      "countryFi": "Suomi",
      "programmeClass": "secondary_programme",
      "donorStatus": "not_assessed",
      "evidenceSignalEn": "Annual reporting by brand, type and sales method is required; the remote-sales ban narrows channel uncertainty.",
      "evidenceSignalFi": "Vuosittainen raportointi brändin, tyypin ja myyntitavan mukaan on pakollista; etämyyntikielto kaventaa kanavaepävarmuutta.",
      "blockingGapsEn": ["Public sales aggregate", "Device value", "Consumer-retail transaction level"],
      "blockingGapsFi": ["Julkinen myyntikooste", "Laitteiden arvo", "Kuluttajavähittäiskaupan tapahtumataso"],
      "officialSources": [
        {
          "labelEn": "Finnish Tobacco Act",
          "labelFi": "Suomen tupakkalaki",
          "url": "https://www.finlex.fi/api/media/statute-foreign-language-translation/687849/mainPdf/main.pdf",
          "verifiedOn": "2026-07-27"
        },
        {
          "labelEn": "Finnish Tax Administration tobacco excise",
          "labelFi": "Verohallinnon tupakkavero-ohje",
          "url": "https://www.vero.fi/yritykset-ja-yhteisot/verot-ja-maksut/valmisteverotus/tupakkavero/",
          "verifiedOn": "2026-07-27"
        }
      ]
    },
    {
      "rank": 4,
      "countryIso2": "DK",
      "countryEn": "Denmark",
      "countryFi": "Tanska",
      "programmeClass": "secondary_programme",
      "donorStatus": "not_assessed",
      "evidenceSignalEn": "The authority describes annual EU-CEG sales reporting for electronic cigarettes and refill containers.",
      "evidenceSignalFi": "Viranomainen kuvaa sähkötupakoiden ja täyttösäiliöiden vuotuisen EU-CEG-myyntiraportoinnin.",
      "blockingGapsEn": ["Aggregate availability", "Retail value", "Channel coverage", "Missingness"],
      "blockingGapsFi": ["Koosteen saatavuus", "Vähittäisarvo", "Kanavapeitto", "Puuttuvuus"],
      "officialSources": [
        {
          "labelEn": "Danish Safety Technology Authority EU-CEG guidance",
          "labelFi": "Tanskan turvallisuusteknologiaviraston EU-CEG-ohje",
          "url": "https://www.sik.dk/en/node/936",
          "verifiedOn": "2026-07-27"
        }
      ]
    },
    {
      "rank": 5,
      "countryIso2": "FR",
      "countryEn": "France",
      "countryFi": "Ranska",
      "programmeClass": "secondary_programme",
      "donorStatus": "not_assessed",
      "evidenceSignalEn": "ANSES has already analysed EU-CEG vaping sales records and their data-quality limits.",
      "evidenceSignalFi": "ANSES on jo analysoinut EU-CEG:n sähkötupakkamyyntitietoja ja niiden laaturajoja.",
      "blockingGapsEn": ["Current national value", "Completeness", "Consumer-retail boundary"],
      "blockingGapsFi": ["Ajantasainen kansallinen arvo", "Täydellisyys", "Kuluttajavähittäiskaupan rajaus"],
      "officialSources": [
        {
          "labelEn": "ANSES vaping-products portal",
          "labelFi": "ANSES:n vaping-tuoteportaali",
          "url": "https://www.anses.fr/fr/content/produits-du-vapotage",
          "verifiedOn": "2026-07-27"
        },
        {
          "labelEn": "ANSES official EU-CEG analysis",
          "labelFi": "ANSES:n virallinen EU-CEG-analyysi",
          "url": "https://www.anses.fr/fr/system/files?file=CONSO2018SA0189Ra-2.pdf",
          "verifiedOn": "2026-07-27"
        }
      ]
    },
    {
      "rank": 6,
      "countryIso2": "AE",
      "countryEn": "United Arab Emirates",
      "countryFi": "Yhdistyneet arabiemiirikunnat",
      "programmeClass": "monitor",
      "donorStatus": "not_assessed",
      "evidenceSignalEn": "Devices and liquids are subject to excise and the taxable value route references a designated retail price.",
      "evidenceSignalFi": "Laitteet ja nesteet kuuluvat valmisteveron piiriin, ja verotusarvoreitti viittaa määrättyyn vähittäishintaan.",
      "blockingGapsEn": ["Public category total", "Observed consumer sell-through", "Independent volume bridge"],
      "blockingGapsFi": ["Julkinen kategoriasumma", "Havaittu kuluttajamyynti", "Riippumaton määräsilta"],
      "officialSources": [
        {
          "labelEn": "Federal Tax Authority excise registration",
          "labelFi": "Liittovaltion veroviranomaisen valmisteverorekisteröinti",
          "url": "https://tax.gov.ae/en/taxes/excise.tax/excise.tax.topics/mechanism.for.registering.excise.aspx",
          "verifiedOn": "2026-07-27"
        }
      ]
    },
    {
      "rank": 7,